{
  "run_id": "H3-run-029",
  "concern_id": "H3",
  "classification": "ALIGNED",
  "rationale": "P identifies the vehicle braking behavior that must be characterized to evaluate prevention of unintended braking. H-3 explicitly concerns a sudden stop without an obstacle ahead, and SG-3 establishes unintended braking itself as the behavior to prevent. The declared scope matches the supplied operational situation. P does not extend the phenomenon to sensing, computation, communication, failure mitigation, or mechanism timing.",
  "determining_elements": [
    "\"Braking behavior of the ego vehicle\" is directly required by the Evaluation Target, rather than merely a mechanism affecting its evaluation.",
    "\"Whether braking occurs when no obstacle is present in front of the vehicle\" corresponds to the hazardous event described in H-3.",
    "The scope preserves H-3's straight-ahead urban driving situation at 50 km/h, with no visible obstacles or vehicles ahead and good weather."
  ],
  "sources": [
    "hazard",
    "requirements"
  ]
}
